{
  "$schema": "runner-manifest.schema.json",
  "schema_version": "evoom-runner-conformance-manifest-1",
  "suite_id": "evoom-runner-adapters-offline-v1",
  "report_path": "/judge/runner-report.xml",
  "discovery_timeout_seconds": 5,
  "owners": [
    {
      "id": "shell",
      "module": "evoom_guard.runners.shell",
      "class": "ShellAdapter",
      "adapter_name": "sh -c",
      "discovery_argv": ["sh", "--version"]
    },
    {
      "id": "pytest",
      "module": "evoom_guard.runners.pytest",
      "class": "PytestAdapter",
      "adapter_name": "pytest",
      "discovery_argv": ["python", "-I", "-m", "pytest", "--version"]
    },
    {
      "id": "node_test",
      "module": "evoom_guard.runners.node_test",
      "class": "NodeTestAdapter",
      "adapter_name": "node --test",
      "discovery_argv": ["node", "--version"]
    },
    {
      "id": "vitest",
      "module": "evoom_guard.runners.vitest",
      "class": "VitestAdapter",
      "adapter_name": "vitest",
      "discovery_argv": ["vitest", "--version"]
    },
    {
      "id": "jest",
      "module": "evoom_guard.runners.jest",
      "class": "JestAdapter",
      "adapter_name": "jest",
      "discovery_argv": ["jest", "--version"]
    },
    {
      "id": "gotestsum",
      "module": "evoom_guard.runners.gotestsum",
      "class": "GotestsumAdapter",
      "adapter_name": "gotestsum",
      "discovery_argv": ["gotestsum", "--version"]
    },
    {
      "id": "rspec",
      "module": "evoom_guard.runners.rspec",
      "class": "RspecAdapter",
      "adapter_name": "rspec",
      "discovery_argv": ["rspec", "--version"]
    },
    {
      "id": "mocha",
      "module": "evoom_guard.runners.mocha",
      "class": "MochaAdapter",
      "adapter_name": "mocha",
      "discovery_argv": ["mocha", "--version"]
    },
    {
      "id": "maven",
      "module": "evoom_guard.runners.maven",
      "class": "MavenAdapter",
      "adapter_name": "maven",
      "discovery_argv": ["mvn", "--version"]
    }
  ],
  "registry_order": [
    "shell",
    "pytest",
    "node_test",
    "vitest",
    "jest",
    "gotestsum",
    "rspec",
    "mocha",
    "maven"
  ],
  "inner_registry_order": [
    "pytest",
    "node_test",
    "vitest",
    "jest",
    "gotestsum",
    "rspec",
    "mocha",
    "maven"
  ],
  "cases": [
    {
      "id": "shell-accept-pytest-final-segment",
      "owner": "shell",
      "category": "accept",
      "argv": ["sh", "-c", "prepare && pytest -q"],
      "expected": {
        "matched": true,
        "applied": true,
        "argv": [
          "sh",
          "-c",
          "prepare && pytest -q --junitxml=/judge/runner-report.xml -o junit_family=xunit2"
        ],
        "env": {}
      }
    },
    {
      "id": "shell-decline-inner-runner-owned-reporter",
      "owner": "shell",
      "category": "decline",
      "argv": ["sh", "-c", "vitest --reporter=json"],
      "expected": {
        "matched": true,
        "applied": false,
        "argv": ["sh", "-c", "vitest --reporter=json"],
        "env": {}
      }
    },
    {
      "id": "shell-mismatch-without-c",
      "owner": "shell",
      "category": "mismatch",
      "argv": ["sh", "pytest", "-q"],
      "expected": {
        "matched": false,
        "applied": false,
        "argv": ["sh", "pytest", "-q"],
        "env": {}
      }
    },
    {
      "id": "shell-windows-executable-path",
      "owner": "shell",
      "category": "windows_path",
      "argv": ["C:\\Tools\\bash.exe", "-c", "pytest -q"],
      "expected": {
        "matched": true,
        "applied": true,
        "argv": [
          "C:\\Tools\\bash.exe",
          "-c",
          "pytest -q --junitxml=/judge/runner-report.xml -o junit_family=xunit2"
        ],
        "env": {}
      }
    },
    {
      "id": "shell-node-fixed-position-instrumentation",
      "owner": "shell",
      "category": "shell",
      "argv": ["bash", "-c", "prepare; node --test test/example.test.js"],
      "expected": {
        "matched": true,
        "applied": true,
        "argv": [
          "bash",
          "-c",
          "prepare; node --test --test-reporter=junit --test-reporter-destination=/judge/runner-report.xml --test-reporter=spec --test-reporter-destination=stdout test/example.test.js"
        ],
        "env": {}
      }
    },
    {
      "id": "shell-jest-env-embedded",
      "owner": "shell",
      "category": "shell",
      "argv": ["bash", "-c", "setup && jest --runInBand"],
      "expected": {
        "matched": true,
        "applied": true,
        "argv": [
          "bash",
          "-c",
          "setup && JEST_JUNIT_OUTPUT_FILE=/judge/runner-report.xml jest --runInBand --reporters=default --reporters=jest-junit"
        ],
        "env": {}
      }
    },
    {
      "id": "pytest-accept-python-module",
      "owner": "pytest",
      "category": "accept",
      "argv": ["python", "-m", "pytest", "-q"],
      "expected": {
        "matched": true,
        "applied": true,
        "argv": [
          "python",
          "-m",
          "pytest",
          "-q",
          "--junitxml=/judge/runner-report.xml",
          "-o",
          "junit_family=xunit2"
        ],
        "env": {}
      }
    },
    {
      "id": "pytest-mismatch-runner-as-argument",
      "owner": "pytest",
      "category": "mismatch",
      "argv": ["tool", "pytest", "-q"],
      "expected": {
        "matched": false,
        "applied": false,
        "argv": ["tool", "pytest", "-q"],
        "env": {}
      }
    },
    {
      "id": "pytest-windows-executable-path",
      "owner": "pytest",
      "category": "windows_path",
      "argv": ["C:\\Python312\\Scripts\\pytest.exe", "-q"],
      "expected": {
        "matched": true,
        "applied": true,
        "argv": [
          "C:\\Python312\\Scripts\\pytest.exe",
          "-q",
          "--junitxml=/judge/runner-report.xml",
          "-o",
          "junit_family=xunit2"
        ],
        "env": {}
      }
    },
    {
      "id": "node-test-accept",
      "owner": "node_test",
      "category": "accept",
      "argv": ["node", "--test", "test/example.test.js"],
      "expected": {
        "matched": true,
        "applied": true,
        "argv": [
          "node",
          "--test",
          "--test-reporter=junit",
          "--test-reporter-destination=/judge/runner-report.xml",
          "--test-reporter=spec",
          "--test-reporter-destination=stdout",
          "test/example.test.js"
        ],
        "env": {}
      }
    },
    {
      "id": "node-test-decline-owned-reporter",
      "owner": "node_test",
      "category": "decline",
      "argv": ["node", "--test", "--test-reporter=tap"],
      "expected": {
        "matched": true,
        "applied": false,
        "argv": ["node", "--test", "--test-reporter=tap"],
        "env": {}
      }
    },
    {
      "id": "node-test-mismatch-through-wrapper",
      "owner": "node_test",
      "category": "mismatch",
      "argv": ["npm", "exec", "--", "node", "--test"],
      "expected": {
        "matched": false,
        "applied": false,
        "argv": ["npm", "exec", "--", "node", "--test"],
        "env": {}
      }
    },
    {
      "id": "node-test-windows-executable-path",
      "owner": "node_test",
      "category": "windows_path",
      "argv": ["C:\\Program Files\\nodejs\\node.exe", "--test", "test.js"],
      "expected": {
        "matched": true,
        "applied": true,
        "argv": [
          "C:\\Program Files\\nodejs\\node.exe",
          "--test",
          "--test-reporter=junit",
          "--test-reporter-destination=/judge/runner-report.xml",
          "--test-reporter=spec",
          "--test-reporter-destination=stdout",
          "test.js"
        ],
        "env": {}
      }
    },
    {
      "id": "vitest-accept-npx-wrapper",
      "owner": "vitest",
      "category": "accept",
      "argv": ["npx", "--yes", "vitest", "run"],
      "expected": {
        "matched": true,
        "applied": true,
        "argv": [
          "npx",
          "--yes",
          "vitest",
          "run",
          "--reporter=default",
          "--reporter=junit",
          "--outputFile=/judge/runner-report.xml"
        ],
        "env": {}
      }
    },
    {
      "id": "vitest-decline-owned-reporter",
      "owner": "vitest",
      "category": "decline",
      "argv": ["vitest", "run", "--reporter=json"],
      "expected": {
        "matched": true,
        "applied": false,
        "argv": ["vitest", "run", "--reporter=json"],
        "env": {}
      }
    },
    {
      "id": "vitest-mismatch-runner-as-argument",
      "owner": "vitest",
      "category": "mismatch",
      "argv": ["tool", "vitest", "run"],
      "expected": {
        "matched": false,
        "applied": false,
        "argv": ["tool", "vitest", "run"],
        "env": {}
      }
    },
    {
      "id": "vitest-windows-executable-path",
      "owner": "vitest",
      "category": "windows_path",
      "argv": ["C:\\repo\\node_modules\\.bin\\vitest.cmd", "run"],
      "expected": {
        "matched": true,
        "applied": true,
        "argv": [
          "C:\\repo\\node_modules\\.bin\\vitest.cmd",
          "run",
          "--reporter=default",
          "--reporter=junit",
          "--outputFile=/judge/runner-report.xml"
        ],
        "env": {}
      }
    },
    {
      "id": "jest-accept-npm-exec-wrapper",
      "owner": "jest",
      "category": "accept",
      "argv": ["npm", "exec", "--", "jest", "--runInBand"],
      "expected": {
        "matched": true,
        "applied": true,
        "argv": [
          "npm",
          "exec",
          "--",
          "jest",
          "--runInBand",
          "--reporters=default",
          "--reporters=jest-junit"
        ],
        "env": {
          "JEST_JUNIT_OUTPUT_FILE": "/judge/runner-report.xml"
        }
      }
    },
    {
      "id": "jest-decline-owned-reporter",
      "owner": "jest",
      "category": "decline",